{
    "schemaVersion":  "1.0.0",
    "compilerVersion":  "calibration-review-compiler/0.2.0",
    "id":  "efforthours-public-expansion",
    "version":  "0.1.0",
    "description":  "Second public teacher-estimate corpus adding three immutable MIT-licensed release snapshots and explicit reviewed false-positive exclusions. These weak labels are not independently reviewed and are not production accuracy evidence.",
    "rubric":  {
                   "id":  "ehe-work-item",
                   "version":  "1.1.0"
               },
    "records":  [
                    {
                        "id":  "record:developit-mitt:implementation",
                        "repository":  {
                                           "id":  "repository:github.com/developit/mitt",
                                           "name":  "developit/mitt",
                                           "sourceDigest":  "sha256:135d31133a5cff5924e53febea07eee67c7fb059156ba225cccb262b1abd5d7d"
                                       },
                        "profile":  "implementation",
                        "baselineId":  "senior-contractor-2026-no-ai",
                        "sourceEstimatorVersion":  "seed-rules/0.2.1",
                        "partition":  "development",
                        "sourceEstimateDigest":  "sha256:010f99ea10c6df0bc325e283bb4b2a6d34272a75741cf49747f016c5d32f9bf3",
                        "source":  {
                                       "dataClassification":  "public-redistributable",
                                       "sourceReference":  "https://github.com/developit/mitt",
                                       "revision":  "release:3.0.1",
                                       "licenseExpression":  "MIT",
                                       "redistributionAllowed":  true,
                                       "notes":  "Reviewed from the immutable 3.0.1 release snapshot. Downloaded source archive SHA256 A362926811CB6D28E52FA7F1276C9189595081FFA18FD3CEB87A022D26BA3A2D; in-archive LICENSE SHA256 1CAB22F196264195A4CAEC8CA5630170FDDE76EE8F43346E47021D087332D3B0."
                                   },
                        "review":  {
                                       "status":  "teacher-estimate",
                                       "completedOn":  "2026-08-06",
                                       "reviewers":  [
                                                         {
                                                             "id":  "teacher:openai-codex-gpt-5-2026-08",
                                                             "kind":  "host-ai",
                                                             "role":  "teacher",
                                                             "modelId":  "openai-codex",
                                                             "modelVersion":  "gpt-5"
                                                         }
                                                     ],
                                       "notes":  "Single host-AI teacher review; no independent correction or adjudication. Target-level candidate hours were hidden during label authoring; repository totals were observed during pipeline verification only. Capability totals were estimated after source and evidence inspection, then apportioned across deterministic source partitions. Low/high bounds use the documented risk-tier policy."
                                   },
                        "capabilities":  [
                                             {
                                                 "sourceCapabilityId":  "work:architecture-design:1301c834bf26665d0695",
                                                 "rationale":  "A very small event emitter still needs a coherent generic handler model, wildcard semantics, and mutation-safe dispatch structure.",
                                                 "targets":  [
                                                                 {
                                                                     "hours":  {
                                                                                   "low":  0.75,
                                                                                   "expected":  1.25,
                                                                                   "high":  2
                                                                               },
                                                                     "uncertaintyReasons":  [

                                                                                            ]
                                                                 }
                                                             ]
                                             },
                                             {
                                                 "sourceCapabilityId":  "work:build-tooling:c2c91d07e063088d401a",
                                                 "rationale":  "TypeScript, linting, formatting, declaration generation, bundle construction, size checks, and development scripts form a compact but real toolchain.",
                                                 "targets":  [
                                                                 {
                                                                     "hours":  {
                                                                                   "low":  1.5,
                                                                                   "expected":  2.5,
                                                                                   "high":  4
                                                                               },
                                                                     "uncertaintyReasons":  [

                                                                                            ]
                                                                 }
                                                             ]
                                             },
                                             {
                                                 "sourceCapabilityId":  "work:ci-infrastructure:bee22f5b9a094661eb75",
                                                 "rationale":  "Two focused workflows verify tests and compressed package size with conventional hosted automation.",
                                                 "targets":  [
                                                                 {
                                                                     "hours":  {
                                                                                   "low":  1.25,
                                                                                   "expected":  2,
                                                                                   "high":  3.5
                                                                               },
                                                                     "uncertaintyReasons":  [

                                                                                            ]
                                                                 }
                                                             ]
                                             },
                                             {
                                                 "sourceCapabilityId":  "work:documentation:bebbc838ff439c1b4e49",
                                                 "rationale":  "The maintained README explains the typed API, wildcard handling, examples, browser support, and an API section without extensive operational material.",
                                                 "targets":  [
                                                                 {
                                                                     "hours":  {
                                                                                   "low":  1.25,
                                                                                   "expected":  2,
                                                                                   "high":  3.5
                                                                               },
                                                                     "uncertaintyReasons":  [

                                                                                            ]
                                                                 }
                                                             ]
                                             },
                                             {
                                                 "sourceCapabilityId":  "work:javascript-source-backbone:2f5795bda39a0bae4a33",
                                                 "rationale":  "The implementation is short but deliberately type-safe, including overloads and the observable ordering and removal semantics of direct and wildcard handlers.",
                                                 "targets":  [
                                                                 {
                                                                     "hours":  {
                                                                                   "low":  1.5,
                                                                                   "expected":  2.5,
                                                                                   "high":  4
                                                                               },
                                                                     "uncertaintyReasons":  [